{
  "version": "0.5",
  "generator": "margins-marginalia-react-mock",
  "generated_at": "2026-04-23T22:26:10Z",
  "site": {
    "title": "Margins & Marginalia",
    "description": "Essays, notes, and small observations on writing, design, and slow living.",
    "url": "https://marginsandmarginalia.test",
    "mediaBaseUrl": "https://media.marginsandmarginalia.test",
    "locale": "en-US",
    "postsPerPage": 5,
    "dateFormat": "MMMM DD, YYYY",
    "timeFormat": "HH:mm",
    "timezone": "UTC",
    "disallowComments": false
  },
  "content": {
    "authors": [
      {
        "id": "11111111-1111-4111-8111-111111111111",
        "display_name": "Eliza Marsh",
        "avatar": "/originals/2026/04/eliza-marsh.jpg"
      }
    ],
    "posts": [
      {
        "public_id": 1001,
        "title": "Color and tokens: a reference for the palette",
        "slug": "color-and-tokens",
        "content": "# Color and tokens: a reference for the palette\n\n_A working catalog of the semantic color tokens used across this journal — background, foreground, primary, accent, muted, and the rules in between. Use it as a reference when designing new pages or components._\n\n## A small palette, used well\n\n_Color on this site is doing one of three jobs: holding the page, carrying the words, or pointing at something worth pointing at. Everything else is restraint._\n\nEach color is stored as an HSL triplet on a CSS variable, and surfaced through a Tailwind token like `bg-background` or `text-accent`. Components never reach for raw hex — they ask the system for a role, and the system answers in the current theme.\n\n## Surfaces\n\nThe surfaces are the quiet half of the system — the paper the writing sits on. They change with the theme, but their relationship to one another stays constant.\n\n| Name | Token | HSL | Role |\n|---|---|---|---|\n| Background | `--background` | `40 33% 97%` | The page itself |\n| Foreground | `--foreground` | `25 20% 15%` | Body text and primary marks |\n| Card | `--card` | `0 0% 100%` | Lifted surfaces, post bodies |\n| Muted | `--muted` | `35 20% 94%` | Inline code, chips, soft fills |\n| Secondary | `--secondary` | `35 25% 92%` | Tag pills, quiet buttons |\n\n## Ink and accent\n\nPrimary is the ink — the dark warm tone that carries headings and emphasis. Accent is the only color allowed to raise its voice; it is reserved for links, active states, and the occasional rule.\n\n| Name | Token | HSL | Role |\n|---|---|---|---|\n| Primary | `--primary` | `25 35% 25%` | Headings, strong type, ink marks |\n| Accent | `--accent` | `15 65% 50%` | Links, focus rings, callouts |\n| Destructive | `--destructive` | `0 70% 50%` | Errors and irreversible actions |\n\n## Lines and highlights\n\nBorders, rules, and highlights are the punctuation of the layout. They are almost never pure black — they are tinted to belong to the surface they sit on.\n\n| Name | Token | HSL | Role |\n|---|---|---|---|\n| Border | `--border` | `30 15% 88%` | Inputs, cards, soft divisions |\n| Rule | `--rule` | `25 15% 80%` | Editorial rules between sections |\n| Highlight | `--highlight` | `45 80% 88%` | Marker pen, gentle emphasis |\n| Ring | `--ring` | `15 65% 50%` | Focus outlines |\n\n## Using the tokens\n\nWhen building a new component, reach for a role rather than a color. `bg-card` will follow the theme; `bg-white` will not. The same goes for text — `text-muted-foreground` will read correctly in both light and dark, while a hard-coded gray will betray you the first time the theme changes.\n\n```tsx\n// Good — semantic, theme-aware\n<aside className=\"bg-card text-card-foreground border border-rule\">\n  <p className=\"text-muted-foreground\">A quiet note.</p>\n</aside>\n\n// Avoid — hard-coded, theme-blind\n<aside className=\"bg-white text-black border border-gray-200\">\n  <p className=\"text-gray-500\">A quiet note.</p>\n</aside>\n```\n\n---\n\nIf a design needs a color that isn't here, the answer is almost never to add a one-off. It is to ask whether the role already exists under another name.\n",
        "document_type": "markdown",
        "excerpt": "A working catalog of the semantic color tokens used across this journal — background, foreground, primary, accent, muted, and the rules in between. Use it as a reference when designing new pages or components.",
        "published_at_iso": "2026-04-18T09:00:00Z",
        "updated_at_iso": "2026-04-18T10:00:00Z",
        "author_id": "11111111-1111-4111-8111-111111111111",
        "status": "published",
        "allow_comments": true,
        "category_slugs": [
          "craft"
        ],
        "tag_slugs": [
          "design",
          "craft",
          "color"
        ]
      },
      {
        "public_id": 1002,
        "title": "Typography: a field guide to the page",
        "slug": "typography",
        "content": "# Typography: a field guide to the page\n\n_A working showcase of the type system used across this journal — display serifs, body text, blockquotes, lists, code, and the small print. Use it as a reference when writing new posts._\n\n## The type scale\n\n_Every page on this site is built from a small set of sizes. Restraint is the point — six sizes feel like a system; sixteen feel like a font menu._\n\n- **5xl** — Display — article titles\n- **3xl** — Section — post cards\n- **2xl** — Subsection — H2\n- **xl** — Minor — H3\n- **lg** — Body — long-form reading\n- **sm** — Meta — bylines and notes\n- **xs** — Eyebrow — labels and tags\n\n## Body copy\n\nBody text is set in Fraunces at 1.125rem with generous leading. The serif is doing two jobs at once: it slows the reader down, and it makes a long page of text feel like a place rather than a feed.\n\nItalics are reserved for emphasis and titles — never for whole paragraphs, which start to feel breathless. Bold is rarer still, used only when a word genuinely needs to be a handle the eye can grab.\n\nWhen a sentence wants to take a breath, it does so with an em dash — like this — rather than parentheses, which always feel slightly apologetic.\n\n## Headings and hierarchy\n\nHeadings step down in size and weight, never in color. The accent color is reserved for links and small typographic flourishes, so a heading never has to compete with a callout.\n\n### A third-level heading, for finer divisions\n\nUse H3 sparingly. If a post needs more than two levels of hierarchy, it probably wants to be two posts.\n\n## Pull quotes and blockquotes\n\n> The most important thing about a typographic system is that it gets out of the way of the words. The reader should never notice the type — only the thinking it carries.\n>\n> — Robert Bringhurst, paraphrased\n\nBlockquotes are flagged with a thin accent rule on the left and set in italics. They are for borrowed sentences, not for emphasis on your own.\n\n## Lists\n\nUnordered lists are for things without rank — ingredients, principles, things you noticed on a walk.\n\n- A sentence worth keeping\n- A book to return to in autumn\n- The name of a color you don't yet know\n- One small kindness, unrecorded\n\nOrdered lists are for steps, arguments, or anything where the order is part of the meaning.\n\n1. Read the sentence aloud.\n2. Remove the first three words and read it again.\n3. If it still works, leave it that way.\n\n## Inline elements\n\nInline code, like `const reader = patient`, is set in a monospaced face at slightly smaller size, with a faint background tint to distinguish it from prose without shouting.\n\nLinks are colored in the accent and underlined on hover, never by default — an underlined paragraph is a paragraph that has stopped trusting itself.\n\n<kbd>⌘</kbd> + <kbd>K</kbd> — Open the search palette\n\n## Code blocks\n\nWhen code does need to appear, it gets its own block — monospaced, gently tinted, and never decorated beyond what is useful.\n\n```ts\n// A reader is a function that returns attention.\nexport const read = (text: string) => {\n  return text\n    .split(/\\s+/)\n    .filter(Boolean)\n    .map((word) => word.toLowerCase());\n};\n```\n\n## Rules and small print\n\nHorizontal rules separate movements within a piece, not paragraphs. Use them the way a composer uses a double bar line.\n\n---\n\nCaptions, footnotes, and bylines live in the small-print scale — never below 0.8rem, never in pure black. They are quiet on purpose.\n",
        "document_type": "markdown",
        "excerpt": "A working showcase of the type system used across this journal — display serifs, body text, blockquotes, lists, code, and the small print. Use it as a reference when writing new posts.",
        "published_at_iso": "2026-04-18T09:00:00Z",
        "updated_at_iso": "2026-04-18T10:00:00Z",
        "author_id": "11111111-1111-4111-8111-111111111111",
        "status": "published",
        "allow_comments": true,
        "category_slugs": [
          "craft"
        ],
        "tag_slugs": [
          "typography",
          "craft",
          "design"
        ]
      },
      {
        "public_id": 1003,
        "title": "On keeping a commonplace book in a year of too much information",
        "slug": "commonplace-book",